{
  "schema_version": "1",
  "source_pdf": "PAM_600-3.pdf",
  "source_gcs_key": null,
  "source_doc_id": null,
  "source_pub_number": "DA PAM 600-3",
  "source_doc_type": "DA",
  "extractor_version": "0.1.0",
  "extraction_timestamp": "2026-04-24T10:14:26Z",
  "profile": "army",
  "text_sha256": "1aeaa68f89124f5cec66dbc10bf0a9d624a6075ccce536a75f81de904f68df69",
  "entries": [],
  "metadata": {
    "total_pages": 81,
    "glossary_pages": [],
    "text_layer_present": true,
    "entries_glossary": 0,
    "entries_inline": 0,
    "entries_after_dedup": 0,
    "glossary_used_legacy_fallback": false
  }
}