{
  "schema_version": "1",
  "source_pdf": "AR_12-15_JOINT_SECURITY_COOPERATION_EDUCATION_AND_TRAINING_{SECNAVINST_4950.4B;_AFI_16-105}_ASA_AL_T_2011_01_03_OCR.pdf",
  "source_gcs_key": null,
  "source_doc_id": null,
  "source_pub_number": "AR 12-15",
  "source_doc_type": "AR",
  "extractor_version": "0.1.0",
  "extraction_timestamp": "2026-04-23T01:02:46Z",
  "profile": "army",
  "text_sha256": "7cb33ab8ffe70b24d9b5b050c8f549e01278b34842d577eae83020faaf54c5eb",
  "entries": [
    {
      "term": "UNCLASSIFIED",
      "term_normalized": "unclassified",
      "definition": "PIN 123456–000",
      "source_type": "glossary",
      "section": "Glossary",
      "pdf_page_index": 345,
      "printed_page_label": null,
      "confidence": 0.95,
      "flags": []
    },
    {
      "term": "the term healthcare",
      "term_normalized": "the term healthcare",
      "definition": "both medical and dental care.",
      "source_type": "inline",
      "section": "Chapter 6",
      "pdf_page_index": 151,
      "printed_page_label": null,
      "confidence": 0.65,
      "flags": [
        "inline_inferred"
      ]
    },
    {
      "term": "healthcare",
      "term_normalized": "healthcare",
      "definition": "both medical and dental care.",
      "source_type": "inline",
      "section": "Chapter 6",
      "pdf_page_index": 151,
      "printed_page_label": null,
      "confidence": 0.65,
      "flags": [
        "inline_inferred"
      ]
    }
  ],
  "metadata": {
    "total_pages": 345,
    "glossary_pages": [
      344,
      345
    ],
    "text_layer_present": true,
    "entries_glossary": 1,
    "entries_inline": 2,
    "entries_after_dedup": 3
  }
}