{
  "schema_version": "1",
  "source_pdf": "AR_25-59_OFFICE_SYMBOLS_CIO_2024_02_15_OCR.pdf",
  "source_gcs_key": null,
  "source_doc_id": null,
  "source_pub_number": "AR 25-59",
  "source_doc_type": "AR",
  "extractor_version": "0.1.0",
  "extraction_timestamp": "2026-04-23T10:45:43Z",
  "profile": "army",
  "text_sha256": "0fa3766cb8137e9e69e7dab279e76159d9881e8a7b0bb2e91fdfc37a0a8510c6",
  "entries": [],
  "metadata": {
    "total_pages": 14,
    "glossary_pages": [],
    "text_layer_present": true,
    "entries_glossary": 0,
    "entries_inline": 0,
    "entries_after_dedup": 0,
    "glossary_used_legacy_fallback": false
  }
}