{
  "schema_version": "1",
  "source_pdf": "AR_11-7_INTERNAL_REVIEW_PROGRAM_ASA_FM_C_2025_05_21_OCR.pdf",
  "source_gcs_key": null,
  "source_doc_id": null,
  "source_pub_number": "AR 11-7",
  "source_doc_type": "AR",
  "extractor_version": "0.1.0",
  "extraction_timestamp": "2026-04-23T10:45:39Z",
  "profile": "army",
  "text_sha256": "e0577e42510afe48a0bd204d511f0848eba6f58b818c735cb527c2e282269283",
  "entries": [],
  "metadata": {
    "total_pages": 32,
    "glossary_pages": [],
    "text_layer_present": true,
    "entries_glossary": 0,
    "entries_inline": 0,
    "entries_after_dedup": 0,
    "glossary_used_legacy_fallback": false
  }
}