{
  "schema_version": "1",
  "source_pdf": "PAM_770-3_TYPE_CLASSIFICATION_AND_MATERIEL_RELEASE_PROCEDURES_2025_05_02_OCR.pdf",
  "source_gcs_key": null,
  "source_doc_id": null,
  "source_pub_number": "DA PAM 770-3",
  "source_doc_type": "DA",
  "extractor_version": "0.1.0",
  "extraction_timestamp": "2026-04-24T10:14:27Z",
  "profile": "army",
  "text_sha256": "33673935fe79e58bcdbcaa6797f1123d95d8f5ebfbfa69a11f343c594fef7a7d",
  "entries": [],
  "metadata": {
    "total_pages": 33,
    "glossary_pages": [],
    "text_layer_present": true,
    "entries_glossary": 0,
    "entries_inline": 0,
    "entries_after_dedup": 0,
    "glossary_used_legacy_fallback": false
  }
}