{
  "schema_version": "1",
  "source_pdf": "PAM_385-64_AMMUNITION_AND_EXPLOSIVES_SAFETY_STANDARDS_2023_07_24_OCR.pdf",
  "source_gcs_key": null,
  "source_doc_id": null,
  "source_pub_number": "DA PAM 385-64",
  "source_doc_type": "DA",
  "extractor_version": "0.1.0",
  "extraction_timestamp": "2026-04-24T10:14:25Z",
  "profile": "army",
  "text_sha256": "b920a342c857f28efa12def93bf5bad953879d3c658a5c0461898d71743a0e8e",
  "entries": [],
  "metadata": {
    "total_pages": 227,
    "glossary_pages": [],
    "text_layer_present": true,
    "entries_glossary": 0,
    "entries_inline": 0,
    "entries_after_dedup": 0,
    "glossary_used_legacy_fallback": false
  }
}