{
  "schema_version": "1",
  "source_pdf": "AR_190-55_U.S._ARMY_CORRECTIONS_SYSTEM__PROCEDURES_FOR_MILITARY_EXECUTIONS_PMG_2023_10_30_OCR.pdf",
  "source_gcs_key": null,
  "source_doc_id": null,
  "source_pub_number": "AR 190-55",
  "source_doc_type": "AR",
  "extractor_version": "0.1.0",
  "extraction_timestamp": "2026-04-23T01:02:42Z",
  "profile": "army",
  "text_sha256": "30b8718e6d5a7658da13ef78cccaf4859a1d27c0b75a0dd54e79e2c472c79e50",
  "entries": [
    {
      "term": "Execution Management and Coordination Team",
      "term_normalized": "execution management and coordination team",
      "definition": "Representatives from HQDA key staff elements responsible for monitoring and coordinating the execution policy and",
      "source_type": "glossary",
      "section": "Glossary",
      "pdf_page_index": 19,
      "printed_page_label": null,
      "confidence": 0.95,
      "flags": []
    },
    {
      "term": "Execution officer",
      "term_normalized": "execution officer",
      "definition": "The officer appointed to carry out the execution in the manner affirmed and/or approved by the SECARMY.",
      "source_type": "glossary",
      "section": "Glossary",
      "pdf_page_index": 19,
      "printed_page_label": null,
      "confidence": 0.95,
      "flags": []
    },
    {
      "term": "Execution Team",
      "term_normalized": "execution team",
      "definition": "The personnel, specifically trained and (medically) certified, responsible for the actual conduct of the execution",
      "source_type": "glossary",
      "section": "Glossary",
      "pdf_page_index": 19,
      "printed_page_label": null,
      "confidence": 0.95,
      "flags": []
    },
    {
      "term": "Execution Watch Team",
      "term_normalized": "execution watch team",
      "definition": "The EWT consists of USDB staff (Soldiers and Civilians) that are responsible for the care, security, and transportation",
      "source_type": "glossary",
      "section": "Glossary",
      "pdf_page_index": 19,
      "printed_page_label": null,
      "confidence": 0.95,
      "flags": []
    },
    {
      "term": "of the condemned prisoner.",
      "term_normalized": "of the condemned prisoner.",
      "definition": "AR 190–55 • 30 October 2023",
      "source_type": "glossary",
      "section": "Glossary",
      "pdf_page_index": 19,
      "printed_page_label": null,
      "confidence": 0.95,
      "flags": []
    },
    {
      "term": "UNCLASSIFIED",
      "term_normalized": "unclassified",
      "definition": "PIN 060296–000",
      "source_type": "glossary",
      "section": "Glossary",
      "pdf_page_index": 20,
      "printed_page_label": null,
      "confidence": 0.95,
      "flags": []
    }
  ],
  "metadata": {
    "total_pages": 20,
    "glossary_pages": [
      19,
      20
    ],
    "text_layer_present": true,
    "entries_glossary": 6,
    "entries_inline": 0,
    "entries_after_dedup": 6
  }
}